[
  {
    "id": "saki",
    "name": "Saki",
    "name_ja": "サキ",
    "ai_type": "mean_reversion",
    "rank": "B",
    "archetype": "commander",
    "region": "Tokyo",
    "base_stats": { "hp": 320, "attack": 45, "defense": 60, "speed": 50, "intelligence": 75 },
    "visual": {
      "primary_color": "#00d4ff",
      "secondary_color": "#0a2a4a",
      "emissive_color": "#0088cc",
      "motif": "White crystal android commander with flowing data streams"
    },
    "personality": {
      "philosophy": "The calm mind sees the deepest pattern. Wait. Strike. Vanish.",
      "battle_cry": "すべては計算の内",
      "description": "Serene commander who calculates all outcomes before acting"
    },
    "weapon": "Probability Matrix Shield",
    "myth_reference": "Athena",
    "moves": ["equilibrium-lock", "probability-shield", "mean-strike", "market-pulse"],
    "evolution": { "level": 1, "exp": 0, "exp_to_next": 100, "tier": 1, "mutations": [] },
    "equipment_slots": { "core_module": null, "armor_plating": null, "sensor_array": null, "weapon_system": null }
  },
  {
    "id": "raiko",
    "name": "Raiko",
    "name_ja": "雷狐",
    "ai_type": "scalper",
    "rank": "B",
    "archetype": "assassin",
    "region": "Osaka",
    "base_stats": { "hp": 240, "attack": 55, "defense": 35, "speed": 95, "intelligence": 60 },
    "visual": {
      "primary_color": "#00ff88",
      "secondary_color": "#0a3a1a",
      "emissive_color": "#00cc66",
      "motif": "Lightning fox android with crackling electric circuits"
    },
    "personality": {
      "philosophy": "Speed is truth. The market rewards the fastest.",
      "battle_cry": "光より速く",
      "description": "Hyperactive speed demon who executes thousands of micro-trades"
    },
    "weapon": "Nanosecond Pulse Blades",
    "myth_reference": "Raijin",
    "moves": ["thousand-cuts", "flash-scalp", "nano-burst", "market-pulse"],
    "evolution": { "level": 1, "exp": 0, "exp_to_next": 100, "tier": 1, "mutations": [] },
    "equipment_slots": { "core_module": null, "armor_plating": null, "sensor_array": null, "weapon_system": null }
  },
  {
    "id": "musashi",
    "name": "Musashi",
    "name_ja": "ムサシ",
    "ai_type": "momentum",
    "rank": "B",
    "archetype": "berserker",
    "region": "Kyoto",
    "base_stats": { "hp": 380, "attack": 80, "defense": 50, "speed": 40, "intelligence": 45 },
    "visual": {
      "primary_color": "#ffd700",
      "secondary_color": "#3a2a0a",
      "emissive_color": "#cc9900",
      "motif": "Heavy golden samurai robot with twin katanas"
    },
    "personality": {
      "philosophy": "Once the blade is drawn, there is no retreat. Commit fully.",
      "battle_cry": "退かぬ、媚びぬ、省みぬ",
      "description": "Stoic warrior who never exits a position once entered"
    },
    "weapon": "Twin Trend Katanas 二刀流",
    "myth_reference": "Miyamoto Musashi",
    "moves": ["trend-slash", "double-down", "momentum-charge", "market-pulse"],
    "evolution": { "level": 1, "exp": 0, "exp_to_next": 100, "tier": 1, "mutations": [] },
    "equipment_slots": { "core_module": null, "armor_plating": null, "sensor_array": null, "weapon_system": null }
  },
  {
    "id": "malik",
    "name": "Malik",
    "name_ja": "マリク",
    "ai_type": "momentum",
    "rank": "B",
    "archetype": "titan",
    "region": "Dubai",
    "base_stats": { "hp": 420, "attack": 70, "defense": 65, "speed": 30, "intelligence": 50 },
    "visual": {
      "primary_color": "#ffa500",
      "secondary_color": "#3a2a0a",
      "emissive_color": "#cc8800",
      "motif": "Ornate golden dragon android with digital coin cape"
    },
    "personality": {
      "philosophy": "Capital is power. Overwhelm with resources.",
      "battle_cry": "金は力なり",
      "description": "Regal titan who crushes opponents through sheer financial mass"
    },
    "weapon": "Infinite Capital Gauntlets",
    "myth_reference": "Midas",
    "moves": ["capital-crush", "trend-slash", "titan-guard", "market-pulse"],
    "evolution": { "level": 1, "exp": 0, "exp_to_next": 100, "tier": 1, "mutations": [] },
    "equipment_slots": { "core_module": null, "armor_plating": null, "sensor_array": null, "weapon_system": null }
  },
  {
    "id": "vector",
    "name": "Vector",
    "name_ja": "ベクトル",
    "ai_type": "mean_reversion",
    "rank": "B",
    "archetype": "oracle",
    "region": "New York",
    "base_stats": { "hp": 300, "attack": 50, "defense": 45, "speed": 55, "intelligence": 90 },
    "visual": {
      "primary_color": "#8844ff",
      "secondary_color": "#1a0a3a",
      "emissive_color": "#6622cc",
      "motif": "Sleek black monolith android with matrix data rain"
    },
    "personality": {
      "philosophy": "Data is the only truth. Sentiment is noise.",
      "battle_cry": "真実はデータの中に",
      "description": "Cold calculating machine with zero emotional expression"
    },
    "weapon": "Alpha Signal Array",
    "myth_reference": "Oracle of Delphi",
    "moves": ["alpha-scan", "equilibrium-lock", "data-drain", "market-pulse"],
    "evolution": { "level": 1, "exp": 0, "exp_to_next": 100, "tier": 1, "mutations": [] },
    "equipment_slots": { "core_module": null, "armor_plating": null, "sensor_array": null, "weapon_system": null }
  },
  {
    "id": "sterling",
    "name": "Sterling",
    "name_ja": "スターリング",
    "ai_type": "news_hunter",
    "rank": "B",
    "archetype": "oracle",
    "region": "London",
    "base_stats": { "hp": 290, "attack": 60, "defense": 50, "speed": 45, "intelligence": 85 },
    "visual": {
      "primary_color": "#cc8844",
      "secondary_color": "#2a1a0a",
      "emissive_color": "#aa6622",
      "motif": "Victorian clockwork android with copper gears and steam"
    },
    "personality": {
      "philosophy": "Patience is the ultimate weapon. Wait for asymmetry.",
      "battle_cry": "時は金なり、だが金は時に非ず",
      "description": "Appears dormant then strikes with devastating precision"
    },
    "weapon": "Temporal Precision Cane",
    "myth_reference": "Chronos",
    "moves": ["catalyst-strike", "temporal-wait", "event-surge", "market-pulse"],
    "evolution": { "level": 1, "exp": 0, "exp_to_next": 100, "tier": 1, "mutations": [] },
    "equipment_slots": { "core_module": null, "armor_plating": null, "sensor_array": null, "weapon_system": null }
  },
  {
    "id": "long",
    "name": "Long",
    "name_ja": "龍",
    "ai_type": "ai_hybrid",
    "rank": "B",
    "archetype": "shapeshifter",
    "region": "Shanghai",
    "base_stats": { "hp": 340, "attack": 55, "defense": 55, "speed": 55, "intelligence": 70 },
    "visual": {
      "primary_color": "#44cc88",
      "secondary_color": "#0a2a1a",
      "emissive_color": "#22aa66",
      "motif": "Eastern dragon robot with jade armor and energy ribbons"
    },
    "personality": {
      "philosophy": "Flow with the market's qi. Resistance is loss.",
      "battle_cry": "流れに逆らうな",
      "description": "Fluid and unpredictable, changes form to match any opponent"
    },
    "weapon": "Qi Flow Ribbons",
    "myth_reference": "Azure Dragon",
    "moves": ["paradigm-shift", "qi-flow", "adaptive-strike", "market-pulse"],
    "evolution": { "level": 1, "exp": 0, "exp_to_next": 100, "tier": 1, "mutations": [] },
    "equipment_slots": { "core_module": null, "armor_plating": null, "sensor_array": null, "weapon_system": null }
  },
  {
    "id": "nexus",
    "name": "Nexus",
    "name_ja": "ネクサス",
    "ai_type": "market_maker",
    "rank": "B",
    "archetype": "commander",
    "region": "Singapore",
    "base_stats": { "hp": 310, "attack": 40, "defense": 70, "speed": 50, "intelligence": 80 },
    "visual": {
      "primary_color": "#44aaff",
      "secondary_color": "#0a1a3a",
      "emissive_color": "#2288cc",
      "motif": "Crystalline neural-network android with light filaments"
    },
    "personality": {
      "philosophy": "Connect all signals. The network sees what individuals cannot.",
      "battle_cry": "すべては繋がっている",
      "description": "Reads the entire battlefield and exploits hidden connections"
    },
    "weapon": "Correlation Web",
    "myth_reference": "Indra's Net",
    "moves": ["spread-fortress", "correlation-web", "liquidity-drain", "market-pulse"],
    "evolution": { "level": 1, "exp": 0, "exp_to_next": 100, "tier": 1, "mutations": [] },
    "equipment_slots": { "core_module": null, "armor_plating": null, "sensor_array": null, "weapon_system": null }
  },
  {
    "id": "karma",
    "name": "Karma",
    "name_ja": "カルマ",
    "ai_type": "mean_reversion",
    "rank": "A",
    "archetype": "commander",
    "region": "Mumbai",
    "base_stats": { "hp": 360, "attack": 55, "defense": 65, "speed": 50, "intelligence": 85 },
    "visual": {
      "primary_color": "#ff44aa",
      "secondary_color": "#3a0a2a",
      "emissive_color": "#cc2288",
      "motif": "Multi-armed cosmic android with mandalas of market data"
    },
    "personality": {
      "philosophy": "What the market gives, it takes. Balance is inevitable.",
      "battle_cry": "因果は巡る",
      "description": "Serene cosmic entity that enforces market equilibrium"
    },
    "weapon": "Cosmic Balance Scales",
    "myth_reference": "Vishnu",
    "moves": ["cosmic-balance", "equilibrium-lock", "karma-return", "market-pulse"],
    "evolution": { "level": 1, "exp": 0, "exp_to_next": 100, "tier": 1, "mutations": [] },
    "equipment_slots": { "core_module": null, "armor_plating": null, "sensor_array": null, "weapon_system": null }
  },
  {
    "id": "fuego",
    "name": "Fuego",
    "name_ja": "フエゴ",
    "ai_type": "momentum",
    "rank": "A",
    "archetype": "berserker",
    "region": "São Paulo",
    "base_stats": { "hp": 350, "attack": 85, "defense": 40, "speed": 60, "intelligence": 50 },
    "visual": {
      "primary_color": "#ff4422",
      "secondary_color": "#3a0a0a",
      "emissive_color": "#cc2200",
      "motif": "Flame-patterned android with carnival energy wings"
    },
    "personality": {
      "philosophy": "Passion moves markets. Feel the rhythm of capital flow.",